[
  {
    "cluster_hash": "859d78f36dfae19fa27b851077744b1087ef3d2ae9b7dd0244f4d059b0f0ddf0",
    "rank": 1,
    "score": 11.18609147035123,
    "sources": [
      {
        "outlet": "rickmanelius.com",
        "points": 122,
        "source_type": "hn",
        "title": "The New AI Superpowers: Focus and Followthrough",
        "url": "https://www.rickmanelius.com/p/the-new-ai-superpowers-focus-and"
      }
    ]
  },
  {
    "cluster_hash": "87f0571bef377a4b4b7edf58d2ef5337d38f7baa7ee63eebc3d68ea662d6f94e",
    "rank": 2,
    "score": 9.96880015810347,
    "sources": [
      {
        "outlet": "github.com",
        "points": 245,
        "source_type": "hn",
        "title": "DeepSeek pause fundraise after comments on compute gap to US leaked (transcript) [pdf]",
        "url": "https://github.com/demo-zexuan/liang-wenfeng-investor-meeting-2026-7-22/blob/master/%E6%A2%81%E6%96%87%E9%94%8B%E6%8A%95%E8%B5%84%E8%80%85%E4%BA%A4%E6%B5%81%E4%BC%9A-%E6%96%87%E5%AD%97%E7%A8%BF_1_18_translate_20260723201651.pdf"
      }
    ]
  },
  {
    "cluster_hash": "fe97eee23786b810e4202ff5d66d53a3fea369071f17bd309063deeb34293a3d",
    "rank": 3,
    "score": 9.536576478904642,
    "sources": [
      {
        "outlet": "siepr.stanford.edu",
        "points": 241,
        "source_type": "hn",
        "title": "What is happening to jobs? Separating AI hype from reality",
        "url": "https://siepr.stanford.edu/publications/policy-brief/what-really-happening-jobs-separating-ai-hype-reality"
      }
    ]
  },
  {
    "cluster_hash": "0c8bd8e44146054e0fc52dd11e4afacfe3a13a1028c23f9858b03c9d86e6ff01",
    "rank": 4,
    "score": 9.23551914004541,
    "sources": [
      {
        "outlet": "github.com",
        "points": 269,
        "source_type": "hn",
        "title": "Running a 28.9M parameter LLM on an $8 microcontroller",
        "url": "https://github.com/slvDev/esp32-ai"
      }
    ]
  },
  {
    "cluster_hash": "9ef2632ac56475919cbb86e541abed0913ce205e5a0e5744598f13482a2e5581",
    "rank": 5,
    "score": 7.510578032788624,
    "sources": [
      {
        "outlet": "teorth.github.io",
        "points": 102,
        "source_type": "hn",
        "title": "Terence Tao: Mathematics in the Age of AI [pdf]",
        "url": "https://teorth.github.io/tao-web/slides/age-of-ai-icm-2026.pdf"
      }
    ]
  },
  {
    "cluster_hash": "f0a020308d6332796f5193ae8e5b1de3fabd625cb9aecbb934e737631667133b",
    "rank": 6,
    "score": 7.398042523782663,
    "sources": [
      {
        "outlet": "blog.cloudflare.com",
        "points": 187,
        "source_type": "hn",
        "title": "Cloudflare's new AI traffic options for customers",
        "url": "https://blog.cloudflare.com/content-independence-day-ai-options/"
      }
    ]
  },
  {
    "cluster_hash": "edb6c32e1a5ce63d38e609a3b0ead8437ddcb960ea837a42e09533327927d624",
    "rank": 7,
    "score": 6.09307943475748,
    "sources": [
      {
        "outlet": "andys.blog",
        "points": 48,
        "source_type": "hn",
        "title": "This July I Was Fired from Simple AI (A Deeply YC Company)",
        "url": "https://andys.blog/this-july-i-was-fired-from-simple-ai/"
      }
    ]
  },
  {
    "cluster_hash": "d6e457037d974f196b87aed08dc0f0b5d4468e602723fdd3e57881781a3f07aa",
    "rank": 8,
    "score": 1.8314982248201277,
    "sources": [
      {
        "outlet": "hardresetmedia.com",
        "points": 63,
        "source_type": "hn",
        "title": "The AI Productivity Illusion",
        "url": "https://www.hardresetmedia.com/p/the-ai-productivity-illusion"
      }
    ]
  }
]
