[
  {
    "cluster_hash": "9f2c1e4d7a6b5c3e8f1a0d9b2c4e6f8a1b3d5c7e9f0a2b4c6d8e0f1a3b5c7d9e",
    "rank": 1,
    "score": 18.4,
    "sources": [
      {
        "url": "https://example-lab.test/blog/example-model-5",
        "source_type": "lab",
        "title": "Announcing Example Model 5",
        "outlet": null,
        "points": null
      },
      {
        "url": "https://news.ycombinator.com/item?id=1234567",
        "source_type": "hn",
        "title": "Example Lab ships Example Model 5",
        "outlet": "news.ycombinator.com",
        "points": 312
      }
    ]
  }
]
